<?xml version="1.0" encoding="utf-8" ?>
<namespace id="sqlserver.query" indented="true" xmlns="never.easysql" xsi:schemaLocation="never.easysql ../../../App_Config/easysql.xsd" xmlns:xsi="http://www.w3.org/2001/XMLSchema-instance">

  <sql id="qryEmailCodeInfoScout">
    <ifnotnull parameter="AggregateId" then="and">
      a.AggregateId = @AggregateId
    </ifnotnull>
    <ifnotnull parameter="Email" then="and">
      a.Email = @Email
    </ifnotnull>
    <ifnotnull parameter="UsageType" then="and">
      a.UsageType = @UsageType
    </ifnotnull>
    <ifnotnull parameter="UsageStatus" then="and">
      a.UsageStatus= @UsageStatus
    </ifnotnull>
  </sql>

  
  <select id="qry_EmailCodeInfo">
    select p.* from (select row_number() over (
    <ifnotnull parameter="OrderBy" then="">
      $OrderBy$
    </ifnotnull>
    <ifnull parameter="OrderBy" then="">
      order by a.Id desc
    </ifnull>
    ) as _,   a.* from email_code as a
    <if then="where" end="" split="">
      <include refid="qryTemplateInfoScout"></include>
    </if>
    ) as p where p._ >= @StartIndex and p._ &lt;= @EndIndex
  </select>

</namespace>